Product code;Language;Product id;Category;List price;Price;Weight;Quantity;Min quantity;Shipping freight;Date added;Downloadable;Files;Ship downloadable;Inventory tracking;Free shipping;Feature comparison;Zero price action;Thumbnail;Detailed image;Product name;Description;Meta keywords;Meta description;Search words;Page title;Taxes;Features;Options;Secondary categories;SEO name;Short description;Localizations;Status;Max quantity;Quantity step;List qty count;Out of stock actions;Product URL;Image URL;Detailed image URL;Items in box;Box size;Store;YM Brand;YM Country of origin;YM Allow retail store purchase;YM Allow booking and self delivery;YM Allow delivery;YM Export Yes;YM Sales notes;YM Market category;YM typePrefix;YM Basic bid;YM Card bid;YM Model
"D00014MK1P";"ru";"1";"Electronics///TV & Video///LED TVs";"6499.99";"5399.99";"0.00";"10";"0";"0.00";"07 Feb 2012 00:00:00";"N";"";"N";"B";"N";"N";"R";"";"/var/www/medinweb.ru/public/var/files/1/exim/backup/images/d85_smartTV.jpg#{[ru]:;}";"65"" Class (64.5"" Diag.) LED 8000 Series Smart TV";"<p>     For the ultimate TV enthusiasts, incredible picture quality and advanced connectivity are just the first step; the Samsung UN65D8000 LED TV goes a step beyond, adding elegant design to the formula. On the commanding 65-inch screen you can enjoy Samsung' Smart TV, which puts the web, a wide range of apps, Skype video calling, and plenty more at your fingertips. Or connect a Blu-ray 3D player to get immersed in cinema-quality 3D programming--two pairs of active glasses are included.</p>";"";"";"";"";"VAT";"Производитель: E[Samsung]";"";"";"65-class-64.5-diag.-led-8000-series-smart-tv";"";"";"A";"0";"0";"0";"N";"http://medinweb.ru/electronics/tv-and-video/led-tvs/65-class-64.5-diag.-led-8000-series-smart-tv.html";"http://medinweb.ru/images/detailed/0/d85_smartTV.jpg";"http://medinweb.ru/images/detailed/0/d85_smartTV.jpg";"min:0;max:0";"length:0;width:0;height:0";"Simtech";"";"";"N";"N";"Y";"Y";"";"";"";"0";"0";""
"E0004UBR1Y";"ru";"4";"Electronics///TV & Video///LED TVs";"0.00";"699.99";"0.00";"1";"0";"0.00";"30 Jan 2007 00:00:00";"N";"";"N";"B";"N";"N";"R";"";"/var/www/medinweb.ru/public/var/files/1/exim/backup/images/UN40D5003BFXZA.jpg#{[ru]:;}";"40"" Class (40.0"" Diag.) LED 5003 Series TV";"<p>Clear Motion Rate (CMR) is Samsung's more comprehensive and accurate measure for how well an LCD or LED TV can display fast-moving images. Previously, motion clarity was expressed simply by the refresh rate, measured in Hz. CMR, however, takes into account all three factors that contribute to motion clarity: panel refresh rate, image processor speed and backlight technology.</p>";"";"";"";"";"VAT";"Производитель: E[Samsung]";"";"";"40-class-40.0-diag.-led-5003-series-tv";"";"";"A";"0";"0";"0";"N";"http://medinweb.ru/electronics/tv-and-video/led-tvs/40-class-40.0-diag.-led-5003-series-tv.html";"http://medinweb.ru/images/detailed/0/UN40D5003BFXZA.jpg";"http://medinweb.ru/images/detailed/0/UN40D5003BFXZA.jpg";"min:0;max:0";"length:0;width:0;height:0";"Simtech";"";"";"N";"N";"Y";"Y";"";"";"";"0";"0";""
"B0005QJH6U";"ru";"5";"Electronics///TV & Video///Plasma TVs";"1199.99";"899.99";"0.00";"9";"0";"0.00";"07 Feb 2012 00:00:00";"N";"";"N";"B";"N";"N";"R";"";"/var/www/medinweb.ru/public/var/files/1/exim/backup/images/LCD_610_Sailing_Frt_3.jpg#{[ru]:;}";"46"" Class (45.9"" Diag.) LCD 610 Series TV";"<p>      ConnectShare™ Movie lets you watch videos, play music or view photos from a USB drive. Simply plug your USB directly into your Samsung TV’s USB port and watch on the big screen with friends and family.</p>";"";"";"";"";"VAT";"Производитель: E[Samsung]";"";"";"46-class-45.9-diag.-lcd-610-series-tv";"";"";"A";"0";"0";"0";"N";"http://medinweb.ru/electronics/tv-and-video/plasma-tvs/46-class-45.9-diag.-lcd-610-series-tv.html";"http://medinweb.ru/images/detailed/0/LCD_610_Sailing_Frt_3.jpg";"http://medinweb.ru/images/detailed/0/LCD_610_Sailing_Frt_3.jpg";"min:0;max:0";"length:0;width:0;height:0";"Simtech";"";"";"N";"N";"Y";"Y";"";"";"";"0";"0";""
"T0006UROBG";"ru";"6";"Electronics///TV & Video///Plasma TVs";"0.00";"329.99";"0.00";"12";"0";"0.00";"09 Feb 2012 00:33:20";"N";"";"N";"B";"N";"N";"R";"";"/var/www/medinweb.ru/public/var/files/1/exim/backup/images/lcd-tv-32C120-01.jpg#{[ru]:;}";"Toshiba 32C120U 32"" Class 720P HD LCD TV";"<p>Think you need to break your budget to enjoy blockbuster HD entertainment? Not with Toshiba's 32"" class C110U LCD HDTV. Featuring all-new design, this value-packed television looks great and works well in a living room, kitchen or bedroom. Increase detail and depth of the images on your screen with our impressive Dynalight technology.</p>";"";"";"";"";"VAT";"Производитель: E[Toshiba]";"";"";"toshiba-32c120u-32-class-720p-hd-lcd-tv";"";"";"A";"0";"0";"0";"N";"http://medinweb.ru/electronics/tv-and-video/plasma-tvs/toshiba-32c120u-32-class-720p-hd-lcd-tv.html";"http://medinweb.ru/images/detailed/0/lcd-tv-32C120-01.jpg";"http://medinweb.ru/images/detailed/0/lcd-tv-32C120-01.jpg";"min:0;max:0";"length:0;width:0;height:0";"Simtech";"";"";"N";"N";"Y";"Y";"";"";"";"0";"0";""
"A0007DQ1TL";"ru";"7";"Apparel///Men's Clothing";"0.00";"55.00";"0.00";"20";"0";"0.00";"07 Feb 2012 00:00:00";"N";"";"N";"B";"N";"N";"R";"";"/var/www/medinweb.ru/public/var/files/1/exim/backup/images/X41185_01.jpg#{[ru]:;}";"Trefoil Hoodie";"<p>The adidas Originals Trefoil Hoodie has been a streetwear essential for  decades, with its characteristic big hood, kangaroo pocket and large  Trefoil. Now it's your turn to join the Trefoil men's hoodie crew and  carry the legend forward.</p>";"";"";"";"";"VAT";"Производитель: E[Adidas]";"(Simtech) Color: S[GreyHeather/Core Energy,Cardinal/PRIME YELLOW,Fairway/White]; (Simtech) Size: S[Small,Medium,Large,X Large,XX Large]";"";"trefoil-hoodie";"";"";"A";"0";"0";"0";"N";"http://medinweb.ru/apparel/mens-clothing/trefoil-hoodie.html";"http://medinweb.ru/images/detailed/0/X41185_01.jpg";"http://medinweb.ru/images/detailed/0/X41185_01.jpg";"min:0;max:0";"length:0;width:0;height:0";"Simtech";"";"";"N";"N";"Y";"Y";"";"";"";"0";"0";""
"W0008TGVI1";"ru";"8";"Electronics///TV & Video///3D TVs";"949.99";"849.99";"0.00";"9";"0";"0.00";"07 Feb 2012 00:00:00";"N";"";"N";"B";"N";"N";"R";"";"/var/www/medinweb.ru/public/var/files/1/exim/backup/images/led-tv-32TL515-01.jpg#{[ru]:;}";"Toshiba 32TL515U 32"" Class 1080P 3D LED HD TV";"<p> Although its attractive features, design, and passive 3D have merit, the picture quality issues of the Toshiba TL515U LED-based LCD TV lessen its appeal in the face of the stiff competition.</p>";"";"";"";"";"VAT";"Производитель: E[Toshiba]";"";"Electronics///TV & Video///LED TVs";"toshiba-32tl515u-32-class-1080p-3d-led-hd-tv";"";"";"A";"0";"0";"0";"N";"http://medinweb.ru/electronics/tv-and-video/led-tvs/toshiba-32tl515u-32-class-1080p-3d-led-hd-tv.html";"http://medinweb.ru/images/detailed/0/led-tv-32TL515-01.jpg";"http://medinweb.ru/images/detailed/0/led-tv-32TL515-01.jpg";"min:0;max:0";"length:0;width:0;height:0";"Simtech";"";"";"N";"N";"Y";"Y";"";"";"";"0";"0";""
"F0009ORD06";"ru";"9";"Electronics///TV & Video///3D TVs";"0.00";"999.99";"0.00";"15";"0";"0.00";"07 Feb 2012 00:00:00";"N";"";"N";"B";"N";"N";"R";"";"/var/www/medinweb.ru/public/var/files/1/exim/backup/images/led-tv-42TL515-01.jpg#{[ru]:;}";"Toshiba 42TL515U 42"" Class 1080P 3D LED HD TV";"<p>Although its attractive features, design, and passive 3D have merit, the picture quality issues of the Toshiba TL515U LED-based LCD TV lessen its appeal in the face of the stiff competition.</p>";"";"";"";"";"VAT";"Производитель: E[Toshiba]";"";"Electronics///TV & Video///LED TVs";"toshiba-42tl515u-42-class-1080p-3d-led-hd-tv";"";"";"A";"0";"0";"0";"N";"http://medinweb.ru/electronics/tv-and-video/led-tvs/toshiba-42tl515u-42-class-1080p-3d-led-hd-tv.html";"http://medinweb.ru/images/detailed/0/led-tv-42TL515-01.jpg";"http://medinweb.ru/images/detailed/0/led-tv-42TL515-01.jpg";"min:0;max:0";"length:0;width:0;height:0";"Simtech";"";"";"N";"N";"Y";"Y";"";"";"";"0";"0";""
"L00102FQ97";"ru";"10";"Electronics///TV & Video///3D TVs";"0.00";"1199.99";"0.00";"7";"0";"0.00";"07 Feb 2012 00:00:00";"N";"";"N";"B";"N";"N";"R";"";"/var/www/medinweb.ru/public/var/files/1/exim/backup/images/47tl515.jpg#{[ru]:;}";"Toshiba 47TL515U 47"" Class 1080P 3D LED HD TV";"<p>Although its attractive features, design, and passive 3D have merit, the picture quality issues of the Toshiba TL515U LED-based LCD TV lessen its appeal in the face of the stiff competition.</p>";"";"";"";"";"VAT";"Производитель: E[Toshiba]";"";"Electronics///TV & Video///LED TVs";"toshiba-47tl515u-47-class-1080p-3d-led-hd-tv";"";"";"A";"0";"0";"0";"N";"http://medinweb.ru/electronics/tv-and-video/led-tvs/toshiba-47tl515u-47-class-1080p-3d-led-hd-tv.html";"http://medinweb.ru/images/detailed/0/47tl515.jpg";"http://medinweb.ru/images/detailed/0/47tl515.jpg";"min:0;max:0";"length:0;width:0;height:0";"Simtech";"";"";"N";"N";"Y";"Y";"";"";"";"0";"0";""
"Z0011CZSNI";"ru";"11";"Apparel///Men's Clothing";"0.00";"30.00";"0.00";"49";"0";"0.00";"07 Feb 2012 00:00:00";"N";"";"N";"B";"N";"N";"R";"";"/var/www/medinweb.ru/public/var/files/1/exim/backup/images/X32444_01.jpg#{[ru]:;}";"Collegiate 72 Tee";"<p>It's not how old you are, it's how stylish, and this men's adidas  Originals Collegiate 72 Tee shirt feels just as fresh as it was the day  the Trefoil was born in 1972. That's why this t-shirt features a  collegiate ""72"" on the front.</p>";"";"";"";"";"VAT";"Производитель: E[Adidas]";"(Simtech) Color: S[White]; (Simtech) Size: S[Small,Medium,Large,X Large,XX Large]";"";"collegiate-72-tee";"";"";"A";"0";"0";"0";"N";"http://medinweb.ru/apparel/mens-clothing/collegiate-72-tee.html";"http://medinweb.ru/images/detailed/0/X32444_01.jpg";"http://medinweb.ru/images/detailed/0/X32444_01.jpg";"min:0;max:0";"length:0;width:0;height:0";"Simtech";"";"";"N";"N";"Y";"Y";"";"";"";"0";"0";""
"U0012O5AF0";"ru";"12";"Apparel///Men's Clothing";"31.00";"30.00";"0.00";"10";"0";"0.00";"07 Feb 2012 00:00:00";"N";"";"N";"B";"N";"N";"R";"";"/var/www/medinweb.ru/public/var/files/1/exim/backup/images/173283_0113298267324f438bac97eaf.jpg#{[ru]:;}";"100g Pants";"<p>  When coach calls you off the bench, you need warm-up pants that come off  in three seconds or less. That’s why these men's adidas 100g basketball  pants have tear-away snaps down the sides, so you're ready for action  as fast as a superhero.</p>";"";"";"";"";"VAT";"Производитель: E[Фармстандарт]; reterwtert: S[dgfdsfdsg]";"(Simtech) Color: S[Black/White/White,Dark Navy/White/White,White/Prime Green]; (Simtech) Size: S[Small,Medium,Large,X Large,XX Large]";"";"100g-pants";"";"";"A";"0";"0";"0";"N";"http://medinweb.ru/apparel/mens-clothing/100g-pants.html";"http://medinweb.ru/images/detailed/0/173283_0113298267324f438bac97eaf.jpg";"http://medinweb.ru/images/detailed/0/173283_0113298267324f438bac97eaf.jpg";"min:0;max:0";"length:0;width:0;height:0";"Simtech";"";"";"N";"N";"Y";"Y";"";"";"";"0";"0";""
"J00133PNYZ";"ru";"13";"Books///Business & Investing";"12.00";"11.96";"0.00";"9";"0";"0.00";"07 Feb 2012 00:00:00";"N";"";"N";"B";"N";"N";"R";"";"/var/www/medinweb.ru/public/var/files/1/exim/backup/images/Z2580.jpg#{[ru]:;}";"Your Idea, Inc. 12 Steps to Building a Million Dollar Business -- Starting Today!";"<p style=""text-align: left; color: #000000; font-size: 12px; background-color: #ffffff;"">Every time a new story about how some nobody from nowhere got rich producing some clever new product in his garage, you may think, ""Why can't I do that?"" Well, anyone can--the trick is to take those good ideas and build them into great products that can succeed in the marketplace. In this book, you will get the 12-step plan you need to make your new product or service a profitable reality. You will learn important skills for success, including how to:</p><ul style=""text-align: left; color: #000000; font-size: 12px; background-color: #ffffff;""><li style=""text-align: left;"">Refine their idea to attract a target audience</li><li style=""text-align: left;"">Research the competition</li><li style=""text-align: left;"">Find the right manufacturer</li><li style=""text-align: left;"">Create appropriate brand messaging</li><li style=""text-align: left;"">Build buzz online and beyond</li><li style=""text-align: left;"">Work trade shows and conventions</li></ul><p><span style=""color: #000000; font-family: Arial, sans-serif; font-size: 12px; background-color: #ffffff;"">Written by a woman with no formal business experience who turned her own idea into a million-dollar company, this book is the pragmatic yet inspiring guide every aspiring entrepreneur is looking for.</span></p>";"";"";"";"";"VAT";"";"";"";"your-idea-inc.-12-steps-to-building-a-million-dollar-business-starting-today";"";"";"A";"0";"0";"0";"N";"http://medinweb.ru/books/business-and-investing/your-idea-inc.-12-steps-to-building-a-million-dollar-business-starting-today.html";"http://medinweb.ru/images/detailed/0/Z2580.jpg";"http://medinweb.ru/images/detailed/0/Z2580.jpg";"min:0;max:0";"length:0;width:0;height:0";"Simtech";"";"";"N";"N";"Y";"Y";"";"";"";"0";"0";""
"M0014IVPFH";"ru";"14";"Electronics///TV & Video///Plasma TVs";"0.00";"499.99";"0.00";"14";"0";"0.00";"07 Feb 2012 00:00:00";"N";"";"N";"B";"N";"N";"R";"";"/var/www/medinweb.ru/public/var/files/1/exim/backup/images/40e220u.jpg#{[ru]:;}";"Toshiba 40E220U 40"" Class 1080P HD LCD TV";"<p>Enjoy a stunning picture bursting with color and clarity with the 40-inch Toshiba 40E200U LCD HDTV (40-inch diagonal screen size), featuring a 1080p Full HD resolution that provides twice the pixel resolution of 720p HD models. It provides a number of convenient home entertainment options and key picture quality features, including DynaLight dynamic backlight control for deeper black levels and four HDMI digital inputs for simple high quality connection to cable/satellite boxes, DVD players and more. Plus, the HDMI ports feature fast InstaPort switching for quick changes from one source to another.&nbsp;<br /><br />DynaLight automatically adjusts the backlight intensity based on the image content.<br /><br /> With the Gaming Mode function, you'll experience reduced game control delay and improved reaction time--perfect for PC gaming--and the Photo Frame capability with Auto Slide Show enables you to display slideshows of your favorite images when not watching TV programming. <br /><br /> Boasting a slimming tapered bezel and attractive front panel gradation, the new Horizon design creates a more modern, elegant appearance that also adds a subtle luminance to the logo to further its stylish appeal. Other features include MP3 playback via the integrated USB port, a PC input, and a removable stand.</p>";"";"";"";"";"VAT";"Производитель: E[Toshiba]";"";"";"toshiba-40e220u-40-class-1080p-hd-lcd-tv";"";"";"A";"0";"0";"0";"N";"http://medinweb.ru/electronics/tv-and-video/plasma-tvs/toshiba-40e220u-40-class-1080p-hd-lcd-tv.html";"http://medinweb.ru/images/detailed/0/40e220u.jpg";"http://medinweb.ru/images/detailed/0/40e220u.jpg";"min:0;max:0";"length:0;width:0;height:0";"Simtech";"";"";"N";"N";"Y";"Y";"";"";"";"0";"0";""
"H0015EXYM6";"ru";"15";"Apparel///Men's Clothing";"0.00";"150.00";"0.00";"20";"0";"0.00";"07 Feb 2012 00:00:00";"N";"";"N";"B";"N";"N";"R";"";"/var/www/medinweb.ru/public/var/files/1/exim/backup/images/452499_010_A.jpg#{[ru]:;}";"Nike Chambray Super Runner Men's Jacket";"<div class=""text description black-white""><div class=""product-description-component""><p><strong>The Nike Chambray Super Runner Jacket: A durable, updated classic </strong></p><br /><p>The  timeless Windrunner design gets a premium upgrade in the Nike Chambray  Super Runner Men's Jacket. Created with tough, water-resistant fabric  and a mesh lining, this jacket combines breathability and protection  from the elements.</p><br /><p><strong>Benefits</strong></p><li>Hood with drawcord for an adjustable fit</li><li>Overlay at yoke and raglan sleeves for style and enhanced protection</li><li>Rib cuffs and hem for a fit that stays in place</li><li>Mesh lining for enhanced ventilation</li><li>Durable, wind-resistant fabric to protect against the elements</li><br /><p><strong>Additional Details</strong></p><li>Side zip pockets for secure storage</li><li>Fabric: Body: 100% cotton. Lining and overlay: 100% polyester.</li><li>Machine wash</li><li>Imported</li></div></div>";"";"";"";"";"VAT";"Производитель: E[Nike]";"(Simtech) Size: S[Small,Medium,Large,X Large,XX Large]";"";"nike-chambray-super-runner-mens-jacket";"<p>The  timeless Windrunner design gets a premium upgrade in the Nike Chambray  Super Runner Men's Jacket. Created with tough, water-resistant fabric  and a mesh lining, this jacket combines breathability and protection  from the elements.</p>";"";"A";"0";"0";"0";"N";"http://medinweb.ru/apparel/mens-clothing/nike-chambray-super-runner-mens-jacket.html";"http://medinweb.ru/images/detailed/0/452499_010_A.jpg";"http://medinweb.ru/images/detailed/0/452499_010_A.jpg";"min:0;max:0";"length:0;width:0;height:0";"Simtech";"";"";"N";"N";"Y";"Y";"";"";"";"0";"0";""
"H00162EP2P";"ru";"16";"Electronics///TV & Video///DVD & Blu-ray Players";"0.00";"349.99";"0.00";"6";"0";"0.00";"07 Feb 2012 00:00:00";"N";"";"N";"B";"N";"N";"R";"";"/var/www/medinweb.ru/public/var/files/1/exim/backup/images/BD-D7500_01-copy_5.jpg#{[ru]:;}";"3D Blu-ray Disc™ Player (BD-D7500)";"<p>Whether you are viewing a premium-quality 2D picture or seeing incredible 3D depth, images are breathtakingly real in Samsung Full HD. Combine with a 3D TV and 3D active shutter glasses to view the latest Hollywood 3D titles or amplify your viewing experience by upconverting 2D content to immersive 3D.</p>";"";"";"";"";"VAT";"Производитель: E[Samsung]";"";"";"3d-blu-ray-disc-player-bd-d7500";"";"";"A";"0";"0";"0";"N";"http://medinweb.ru/electronics/tv-and-video/dvd-and-blu-ray-players/3d-blu-ray-disc-player-bd-d7500.html";"http://medinweb.ru/images/detailed/0/BD-D7500_01-copy_5.jpg";"http://medinweb.ru/images/detailed/0/BD-D7500_01-copy_5.jpg";"min:0;max:0";"length:0;width:0;height:0";"Simtech";"";"";"N";"N";"Y";"Y";"";"";"";"0";"0";""
"G0017HS88V";"ru";"17";"Books///Business & Investing";"0.00";"11.16";"0.00";"19";"0";"0.00";"07 Feb 2012 00:00:00";"N";"";"N";"B";"N";"N";"R";"";"/var/www/medinweb.ru/public/var/files/1/exim/backup/images/Z6595.jpg#{[ru]:;}";"101 Things Everyone Should Know About Economics A Down and Dirty Guide to Everything from Securities and Derivatives to Interest Rates and Hedge Funds—And What They Mean For You";"<p><span style=""color: #000000; font-family: Arial, sans-serif; font-size: 12px; background-color: #ffffff;"">What you don't know about economics can hurt you&mdash;now more than ever. This easy-to-understand guide answers all the questions you need to know to secure your financial future, such as:</span></p><ul style=""text-align: left; color: #000000; font-size: 12px; background-color: #ffffff;""><li style=""text-align: left;"">What does it mean to my paycheck when the Fed lowers or raises interest rates?</li><li style=""text-align: left;"">What's the difference between bonds, securities, and derivatives&mdash;and which should I invest in now?</li><li style=""text-align: left;"">What does Keynesian economics have to do with my savings?</li></ul><p><span style=""color: #000000; font-family: Arial, sans-serif; font-size: 12px; background-color: #ffffff;"">For those people whose heads spin when reading the business pages of the newspaper, here's a roadmap through the economic jungle. In simple, plain language, Peter Sander explains how economies work, why they grow, how they contract, and what the government can and can't do to help them. Most important, he tells you how all this affects&nbsp;</span><em style=""color: #000000; font-family: Arial, sans-serif; font-size: 12px; background-color: #ffffff;"">you</em><span style=""color: #000000; font-family: Arial, sans-serif; font-size: 12px; background-color: #ffffff;"">&mdash;and what kind of changes you're going to see in your finances as a result.</span></p><p style=""text-align: left; color: #000000; font-size: 12px; background-color: #ffffff;"">Economics has been called the ""dismal"" science. But it doesn't need to be gloomy or impenetrable. This book is an essential guide for anyone who wants to understand where the economy is today, where it's going, and what it means for the rest of us.</p><p>&nbsp;</p>";"";"";"";"";"VAT";"";"";"";"101-things-everyone-should-know-about-economics-a-down-and-dirty-guide-to-everything-from-securities-and-derivatives-to-interest-rates-and-hedge-fundsand-what-they-mean-for-you";"";"";"A";"0";"0";"0";"N";"http://medinweb.ru/books/business-and-investing/101-things-everyone-should-know-about-economics-a-down-and-dirty-guide-to-everything-from-securities-and-derivatives-to-interest-rates-and-hedge-fundsand-what-they-mean-for-you.html";"http://medinweb.ru/images/detailed/0/Z6595.jpg";"http://medinweb.ru/images/detailed/0/Z6595.jpg";"min:0;max:0";"length:0;width:0;height:0";"Simtech";"";"";"N";"N";"Y";"Y";"";"";"";"0";"0";""
"W0018W504I";"ru";"18";"Electronics///TV & Video///DVD & Blu-ray Players";"0.00";"299.99";"0.00";"3";"0";"0.00";"07 Feb 2012 00:00:00";"N";"";"N";"B";"N";"N";"R";"";"/var/www/medinweb.ru/public/var/files/1/exim/backup/images/BD-D7000_F_5.jpg#{[ru]:;}";"3D Blu-ray Disc™ Player (BD-D7000)";"<p>Whether you are viewing a premium-quality 2D picture or seeing incredible 3D depth, images are breathtakingly real in Samsung Full HD. Combine with a 3D TV and 3D active shutter glasses to view the latest Hollywood 3D titles or amplify your viewing experience by upconverting 2D content to immersive 3D.</p>";"";"";"";"";"VAT";"Производитель: E[Samsung]";"";"";"3d-blu-ray-disc-player-bd-d7000";"";"";"A";"0";"0";"0";"N";"http://medinweb.ru/electronics/tv-and-video/dvd-and-blu-ray-players/3d-blu-ray-disc-player-bd-d7000.html";"http://medinweb.ru/images/detailed/0/BD-D7000_F_5.jpg";"http://medinweb.ru/images/detailed/0/BD-D7000_F_5.jpg";"min:0;max:0";"length:0;width:0;height:0";"Simtech";"";"";"N";"N";"Y";"Y";"";"";"";"0";"0";""
"J001933ZYZ";"ru";"19";"Electronics///TV & Video///DVD & Blu-ray Players";"0.00";"79.99";"0.00";"20";"0";"0.00";"07 Feb 2012 00:00:00";"N";"";"N";"B";"N";"N";"R";"";"/var/www/medinweb.ru/public/var/files/1/exim/backup/images/bluray-bdx2150-600-01.jpg#{[ru]:;}";"Toshiba BDX2150 Blu-ray Player";"<p>Enjoy the clarity of Blu-ray and the convenience of streaming media with the Toshiba BDX2150 Blu-ray Disc player. Wi-Fi ready for clutter-free in-home connectivity (Wi-Fi adapter required, sold separately), this player lets you enjoy your favorite movies with stunning native 1080p Full HD output plus surround sound with Dolby audio enhancements. Internet connectivity enables you to take advantage of popular streaming services such as Blockbuster, Netflix*, CinemaNow, Pandora, Vudu and YouTube. In addition, BD-Live 2.0 technology allows you to access internet-only bonus material available on many Blu-ray titles. Offering both USB and HDMI with CEC ports, this player is equipped with the latest command and control functionality.</p>";"";"";"";"";"VAT";"Производитель: E[Toshiba]";"";"";"toshiba-bdx2150-blu-ray-player";"";"";"A";"0";"0";"0";"N";"http://medinweb.ru/electronics/tv-and-video/dvd-and-blu-ray-players/toshiba-bdx2150-blu-ray-player.html";"http://medinweb.ru/images/detailed/0/bluray-bdx2150-600-01.jpg";"http://medinweb.ru/images/detailed/0/bluray-bdx2150-600-01.jpg";"min:0;max:0";"length:0;width:0;height:0";"Simtech";"";"";"N";"N";"Y";"Y";"";"";"";"0";"0";""
"M00209NIOG";"ru";"20";"Books///Business & Investing";"0.00";"19.95";"0.00";"1";"0";"0.00";"07 Feb 2012 00:00:00";"N";"";"N";"B";"N";"N";"R";"";"/var/www/medinweb.ru/public/var/files/1/exim/backup/images/1886039720.jpg#{[ru]:;}";"The ABCs of Gold Investing. How to Protect and Build Your Wealth with Gold";"<p><em style=""color: #000000; font-family: Verdana; background-color: #ffffff; font-size: small;""><strong>The ABCs of Gold Investing</strong></em><span style=""color: #000000; font-family: Verdana; background-color: #ffffff; font-size: small;"">&nbsp;(Second Edition) is a solid resource for investors wishing to understand the benefits of private gold ownership. In this reader-friendly book, author Michael J. Kosares addresses the rapid changes in both the American and world economies and explains why gold is important to you as an investor. And, with thirty years experience in the gold business, he can tell you how to add gold to your portfolio in a safe and economical manner.</span></p>";"";"";"";"";"VAT";"";"";"";"the-abcs-of-gold-investing.-how-to-protect-and-build-your-wealth-with-gold";"";"";"A";"0";"0";"0";"N";"http://medinweb.ru/books/business-and-investing/the-abcs-of-gold-investing.-how-to-protect-and-build-your-wealth-with-gold.html";"http://medinweb.ru/images/detailed/0/1886039720.jpg";"http://medinweb.ru/images/detailed/0/1886039720.jpg";"min:0;max:0";"length:0;width:0;height:0";"Simtech";"";"";"N";"N";"Y";"Y";"";"";"";"0";"0";""
