"S0175KUFJJ";"ru";"175";"Electronics///Cameras & Photo///Camcorders";"0.00";"179.99";"0.00";"10";"0";"0.00";"08 Feb 2012 00:00:00";"N";"";"N";"B";"N";"N";"R";"";"/var/www/medinweb.ru/public/var/files/1/exim/backup/images/F50_front_5.jpg#{[ru]:;}";"F50 Flash Memory 52x Zoom Camcorder (Silver)";"<p>2.7&rdquo; LCD Touch Panel display gives you a clearer picture of what you are shooting. By leveraging the latest in LCD display technology, the Touch Panel delivers clean, crisp images that are saturated with natural color and deep, dynamic detail, enabling you to shoot with enhanced comfort and confidence in any external light condition.</p>";"";"";"";"";"VAT";"Производитель: E[Samsung]";"";"";"f50-flash-memory-52x-zoom-camcorder-silver";"";"";"A";"0";"0";"0";"N";"http://medinweb.ru/electronics/cameras-and-photo/camcorders/f50-flash-memory-52x-zoom-camcorder-silver.html";"http://medinweb.ru/images/detailed/0/F50_front_5.jpg";"http://medinweb.ru/images/detailed/0/F50_front_5.jpg";"min:0;max:0";"length:0;width:0;height:0";"Simtech";"";"";"N";"N";"Y";"Y";"";"";"";"0";"0";""
"Y01761IUK5";"ru";"176";"Office Supplies///Desk Accessories";"0.00";"648.95";"0.00";"9";"0";"0.00";"08 Feb 2012 00:00:00";"N";"";"N";"B";"N";"N";"R";"";"/var/www/medinweb.ru/public/var/files/1/exim/backup/images/url_uploaded_file_13287009294f325e041c8e1.jpg#{[ru]:;}";"Quartet® Euro™ Magnetic Porcelain Total Erase® Mobile Easel";"<p><p class=""prod16bold"" style=""margin-top: 0px; margin-right: 0px; margin-bottom: 15px; margin-left: 0px; color: #333333; font-weight: bold; font-size: 16px; text-align: left; text-decoration: none; font-family: Verdana, Arial, Helvetica, sans-serif; background-color: #ffffff;""><span id=""_ctl0_MainContent_lblTitle"">Quartet&reg; Euro&trade; Magnetic Porcelain Total Erase&reg; Mobile Easel</span></p><p class=""body12"" style=""margin-top: 0px; margin-right: 0px; margin-bottom: 15px; margin-left: 0px; color: #333333; font-size: 12px; text-align: left; text-decoration: none; font-family: Verdana, Arial, Helvetica, sans-serif; background-color: #ffffff;""><span id=""_ctl0_MainContent_lblDescription"">Ultra-durable, ultra-smooth 27"" x 41"" mobile presentation easel with DuraMax&reg; porcelain surface that will not scratch, dent, stain or ghost. Delivers superior performance when collaboration is needed in high-profile, heavy-use office environments. Magnetic surface doubles as bulletin board. Easy-to-clean writing surface requires minimal use of Quartet&reg; cleaning solutions. Adjustable hooks and clamp hold standard-sized flipcharts for easy sheet tear-away meeting notes. Smooth-rolling 5-caster star-base wheels lock firmly in place for total control and mobility. Flexible spring-loaded height adjuster moves from 67"" to 77"" for optimal height. Includes spacious folding accessory tray and 4 assorted Quartet&reg; whiteboard markers. Sleek Euro&trade; design with matte aluminum finish for maximum style and durability. 100% Satisfaction Guaranteed.</span></p><p class=""body12"" style=""margin-top: 0px; margin-right: 0px; margin-bottom: 15px; margin-left: 0px; color: #333333; font-size: 12px; text-align: left; text-decoration: none; font-family: Verdana, Arial, Helvetica, sans-serif; background-color: #ffffff;""><span id=""_ctl0_MainContent_lblFeatures"">&nbsp;</span></p><ul style=""color: #000000; font-family: Verdana, Arial, Helvetica, sans-serif; font-size: 11px; text-align: left; background-color: #ffffff;""><li class=""body12"" style=""color: #333333; font-size: 12px; text-align: left; text-decoration: none;"">Ultra-durable, ultra-smooth 27"" W x 41"" H mobile presentation easel with DuraMax&reg; porcelain surface that will not scratch, dent, stain or ghost</li><li class=""body12"" style=""color: #333333; font-size: 12px; text-align: left; text-decoration: none;"">Delivers superior performance when collaboration is needed in high-profile, heavy-use office environments</li><li class=""body12"" style=""color: #333333; font-size: 12px; text-align: left; text-decoration: none;"">Magnetic surface doubles as bulletin board</li><li class=""body12"" style=""color: #333333; font-size: 12px; text-align: left; text-decoration: none;"">Adjustable hooks and clamp hold standard-sized flipcharts for easy sheet tear-away</li><li class=""body12"" style=""color: #333333; font-size: 12px; text-align: left; text-decoration: none;"">Easy-to-clean writing surface requires minimal use of Quartet&reg; cleaning solutions</li><li class=""body12"" style=""color: #333333; font-size: 12px; text-align: left; text-decoration: none;"">Smooth-rolling 5-caster star-base wheels lock firmly in place for total control and mobility</li><li class=""body12"" style=""color: #333333; font-size: 12px; text-align: left; text-decoration: none;"">Flexible spring-loaded height adjuster moves from 67"" to 77"" for optimal height</li><li class=""body12"" style=""color: #333333; font-size: 12px; text-align: left; text-decoration: none;"">Includes spacious folding accessory tray and 4 assorted Quartet&reg; whiteboard markers</li><li class=""body12"" style=""color: #333333; font-size: 12px; text-align: left; text-decoration: none;"">Sleek Euro&trade; design with matte aluminum finish for maximum style and durability</li><li class=""body12"" style=""color: #333333; font-size: 12px; text-align: left; text-decoration: none;"">100% Satisfaction Guaranteed</li></ul></p>";"";"";"";"";"VAT";"Производитель: E[Quartet Manufacturing]";"";"";"quartet-euro-magnetic-porcelain-total-erase-mobile-easel";"";"";"A";"0";"0";"0";"N";"http://medinweb.ru/office-supplies/desk-accessories/quartet-euro-magnetic-porcelain-total-erase-mobile-easel.html";"http://medinweb.ru/images/detailed/0/url_uploaded_file_13287009294f325e041c8e1.jpg";"http://medinweb.ru/images/detailed/0/url_uploaded_file_13287009294f325e041c8e1.jpg";"min:0;max:0";"length:0;width:0;height:0";"Simtech";"";"";"N";"N";"Y";"Y";"";"";"";"0";"0";""
"J0177S9SI3";"ru";"177";"Sports & Outdoors///Golf///Golf Clubs";"0.00";"400.00";"0.00";"9";"0";"0.00";"08 Feb 2012 00:00:00";"N";"";"N";"B";"N";"N";"R";"";"/var/www/medinweb.ru/public/var/files/1/exim/backup/images/blkdrv_hero.jpg#{[ru]:;}";"CG BLACK DRIVER";"<p>With a sleek and striking look, the CG Black driver weighs only 265  grams, making it the lightest driver on the market to help players  generate measurable increases in swing speed and distance with the same  swing effort. The advanced aerodynamics found in the driver&rsquo;s Speed  Crown Design &ndash; an innovative, teardrop-inspired crown profile &ndash; maximize  distance by reducing drag at all angles of airflow during the swing.  MaxCOR2 Variable Face Thickness Technology reduces face weight and  increases trampoline effect on off-center hits, meaning higher ball  speed and more distance on off-center hits. Plus, a high-density weight  screw at the rear of the sole plate positions the center of gravity  lower and deeper to promote a high, draw-biased trajectory with optimal  launch conditions for effortless distance. The CG Black driver features a  Miyazaki C. Kua 39 Limited Edition graphite shaft and a Golf Pride  Ultralite grip, a combination that decreases overall club weight for  faster swing speed.</p>";"";"";"";"";"VAT";"Производитель: E[Cleveland]";"";"";"cg-black-driver";"";"";"A";"0";"0";"0";"N";"http://medinweb.ru/sports-and-outdoors/golf/golf-clubs/cg-black-driver.html";"http://medinweb.ru/images/detailed/0/blkdrv_hero.jpg";"http://medinweb.ru/images/detailed/0/blkdrv_hero.jpg";"min:0;max:0";"length:0;width:0;height:0";"Simtech";"";"";"N";"N";"Y";"Y";"";"";"";"0";"0";""
"G0178014M3";"ru";"178";"Office Supplies///Desk Accessories";"0.00";"6.83";"0.00";"35";"0";"0.00";"08 Feb 2012 00:00:00";"N";"";"N";"B";"N";"N";"R";"";"/var/www/medinweb.ru/public/var/files/1/exim/backup/images/mbank30208_w550_h550.jpg#{[ru]:;}";"Wilson Jones® 364 Heavy Duty Round Ring Binder with Label Holder, 1"", Black";"<p><p class=""body12"" style=""margin-top: 0px; margin-right: 0px; margin-bottom: 15px; margin-left: 0px; color: #333333; font-size: 12px; text-align: left; text-decoration: none; font-family: Verdana, Arial, Helvetica, sans-serif; background-color: #ffffff;""><span id=""_ctl0_MainContent_lblDescription"">Built to last, this heavy duty binder with standard round rings is made of flexible polypropylene allowing it to fully protect your documents from the elements. The label holder on the binder spine is perfect for titling your projects.</span></p><p class=""body12"" style=""margin-top: 0px; margin-right: 0px; margin-bottom: 15px; margin-left: 0px; color: #333333; font-size: 12px; text-align: left; text-decoration: none; font-family: Verdana, Arial, Helvetica, sans-serif; background-color: #ffffff;""><span id=""_ctl0_MainContent_lblFeatures"">&nbsp;</span></p><ul style=""color: #000000; font-family: Verdana, Arial, Helvetica, sans-serif; font-size: 11px; text-align: left; background-color: #ffffff;""><li class=""body12"" style=""color: #333333; font-size: 12px; text-align: left; text-decoration: none;"">220 sheet capacity in 1 inch binder size</li><li class=""body12"" style=""color: #333333; font-size: 12px; text-align: left; text-decoration: none;"">No-Gap round rings close tightly</li><li class=""body12"" style=""color: #333333; font-size: 12px; text-align: left; text-decoration: none;"">Eco-friendly, PVC Free polypropylene material is virtually impossible to tear</li><li class=""body12"" style=""color: #333333; font-size: 12px; text-align: left; text-decoration: none;"">100% recycled chipboard and 45% post consumer waste minimum recycled content</li><li class=""body12"" style=""color: #333333; font-size: 12px; text-align: left; text-decoration: none;"">CleanView&trade; protection prevents ink from transferring off papers onto binder</li><li class=""body12"" style=""color: #333333; font-size: 12px; text-align: left; text-decoration: none;"">Two clear interior pockets and label holder on spine</li><li class=""body12"" style=""color: #333333; font-size: 12px; text-align: left; text-decoration: none;"">Available in black, blue and dark red, multiple sizes</li></ul></p>";"";"";"";"";"VAT";"Производитель: E[Wilson Jones]";"";"";"wilson-jones-364-heavy-duty-round-ring-binder-with-label-holder-1-black";"";"";"A";"0";"0";"0";"N";"http://medinweb.ru/office-supplies/desk-accessories/wilson-jones-364-heavy-duty-round-ring-binder-with-label-holder-1-black.html";"http://medinweb.ru/images/detailed/0/mbank30208_w550_h550.jpg";"http://medinweb.ru/images/detailed/0/mbank30208_w550_h550.jpg";"min:0;max:0";"length:0;width:0;height:0";"Simtech";"";"";"N";"N";"Y";"Y";"";"";"";"0";"0";""
"B0179UHL46";"ru";"179";"Sports & Outdoors///Golf///Golf Clubs";"0.00";"299.97";"0.00";"20";"0";"0.00";"08 Feb 2012 00:00:00";"N";"";"N";"B";"N";"N";"R";"";"/var/www/medinweb.ru/public/var/files/1/exim/backup/images/16_bp_1.jpg#{[ru]:;}";"CG16 Black Pearl Wedge";"<div class=""overviewbody""><p>Based on the shape of the tour proven CG14<span style=""font-size: 8pt;"">&trade;</span> wedge, the CG16<span style=""font-size: 8pt;"">&trade;</span> has a hint of offset and is slightly larger for added forgiveness.&nbsp; The  face features the same spin maximizing technology featured on the CG15<span style=""font-size: 8pt;"">&trade;</span> wedge &ndash; Tour Zip Grooves<span style=""font-size: 8pt;"">&trade;</span> in combination with Cleveland<span style=""font-size: 8pt;"">&reg;</span> Golf&rsquo;s breakthrough Laser Milled<span style=""font-size: 8pt;"">&trade; </span>surface  roughness technology.&nbsp; Using the precision accuracy of a laser, each  face features four perfectly calibrated texture lines milled between  each groove exactly to the conforming roughness limit.&nbsp; This surface  roughness application optimizes ball-to-face friction and maximizes spin  within the Rules of Golf.</p></div>";"";"";"";"";"VAT";"Производитель: E[Cleveland]";"";"";"cg16-black-pearl-wedge";"";"";"A";"0";"0";"0";"N";"http://medinweb.ru/sports-and-outdoors/golf/golf-clubs/cg16-black-pearl-wedge.html";"http://medinweb.ru/images/detailed/0/16_bp_1.jpg";"http://medinweb.ru/images/detailed/0/16_bp_1.jpg";"min:0;max:0";"length:0;width:0;height:0";"Simtech";"";"";"N";"N";"Y";"Y";"";"";"";"0";"0";""
"Q01802L8VS";"ru";"180";"Electronics///Cameras & Photo///Lenses";"0.00";"199.99";"0.00";"5";"0";"0.00";"08 Feb 2012 00:00:00";"N";"";"N";"B";"N";"N";"R";"";"/var/www/medinweb.ru/public/var/files/1/exim/backup/images/EX-S1855SB_600.jpg#{[ru]:;}";"18-55mm Portrait Lens";"<p>Certain photos vividly remind you of memorable moments even at a quick glance. You can treasure such everlasting, memories with the 18-55mm lens. This lens enables you to create diverse images from any scene, including wide-angle and portrait shots, making your precious moments last forever.</p>";"";"";"";"";"VAT";"";"";"";"18-55mm-portrait-lens";"";"";"A";"0";"0";"0";"N";"http://medinweb.ru/electronics/cameras-and-photo/lenses/18-55mm-portrait-lens.html";"http://medinweb.ru/images/detailed/0/EX-S1855SB_600.jpg";"http://medinweb.ru/images/detailed/0/EX-S1855SB_600.jpg";"min:0;max:0";"length:0;width:0;height:0";"Simtech";"";"";"N";"N";"Y";"Y";"";"";"";"0";"0";""
"A0181ZSJSS";"ru";"181";"Sports & Outdoors///Golf///Golf Clubs";"0.00";"899.99";"0.00";"20";"0";"0.00";"08 Feb 2012 00:00:00";"N";"";"N";"B";"N";"N";"R";"";"/var/www/medinweb.ru/public/var/files/1/exim/backup/images/bloom_berry_set1.jpg#{[ru]:;}";"Women's Bloom Complete Set";"<p>Created for women golfers looking to improve their game, the Bloom 14 Piece set covers all of her equipment needs. Designed specifically for her swing, the 100% titanium Driver and Stainless Steel Fairway woods are designed with today&rsquo;s modern lightweight and oversized technology to drastically increase distance and consistency-particularly on mishits. The hybrid long irons are hollow and extremely forgiving and are packaged together with the short game simplifying NIBLICK &ndash; to make the game even easier to learn. If that isn&rsquo;t enough, the classically designed mini boot bag has retro details yet modern convenience with ample pocket space and detachable wristlet.</p>";"";"";"";"";"VAT";"Производитель: E[Cleveland]";"";"";"womens-bloom-complete-set";"";"";"A";"0";"0";"0";"N";"http://medinweb.ru/sports-and-outdoors/golf/golf-clubs/womens-bloom-complete-set.html";"http://medinweb.ru/images/detailed/0/bloom_berry_set1.jpg";"http://medinweb.ru/images/detailed/0/bloom_berry_set1.jpg";"min:0;max:0";"length:0;width:0;height:0";"Simtech";"";"";"N";"N";"Y";"Y";"";"";"";"0";"0";""
"N0182YV5QV";"ru";"182";"Office Supplies///Desk Accessories";"0.00";"6.80";"0.00";"30";"0";"0.00";"08 Feb 2012 00:00:00";"N";"";"N";"B";"N";"N";"R";"";"/var/www/medinweb.ru/public/var/files/1/exim/backup/images/mbank15770_w550_h550.jpg#{[ru]:;}";"GBC® Smart-View® 3-Ring Report Cover";"<p><p class=""body12"" style=""margin-top: 0px; margin-right: 0px; margin-bottom: 15px; margin-left: 0px; color: #333333; font-size: 12px; text-align: left; text-decoration: none; font-family: Verdana, Arial, Helvetica, sans-serif; background-color: #ffffff;""><span id=""_ctl0_MainContent_lblDescription"">Clear front cover folds back and keeps title sheet intact by securing it inside cover edge. Interior 3-ring design holds 3-hole punched report pages.</span></p><p class=""body12"" style=""margin-top: 0px; margin-right: 0px; margin-bottom: 15px; margin-left: 0px; color: #333333; font-size: 12px; text-align: left; text-decoration: none; font-family: Verdana, Arial, Helvetica, sans-serif; background-color: #ffffff;""><span id=""_ctl0_MainContent_lblFeatures"">&nbsp;</span></p><ul style=""color: #000000; font-family: Verdana, Arial, Helvetica, sans-serif; font-size: 11px; text-align: left; background-color: #ffffff;""><li class=""body12"" style=""color: #333333; font-size: 12px; text-align: left; text-decoration: none;"">Durable polypropylene material</li><li class=""body12"" style=""color: #333333; font-size: 12px; text-align: left; text-decoration: none;"">Rings hold up to 40 3-hole punched sheets</li><li class=""body12"" style=""color: #333333; font-size: 12px; text-align: left; text-decoration: none;"">Soft, rounded spine and textured cover</li><li class=""body12"" style=""color: #333333; font-size: 12px; text-align: left; text-decoration: none;"">Large back pocket with business card holder</li><li class=""body12"" style=""color: #333333; font-size: 12px; text-align: left; text-decoration: none;"">Black</li></ul></p>";"";"";"";"";"VAT";"";"";"";"gbc-smart-view-3-ring-report-cover";"";"";"A";"0";"0";"0";"N";"http://medinweb.ru/office-supplies/desk-accessories/gbc-smart-view-3-ring-report-cover.html";"http://medinweb.ru/images/detailed/0/mbank15770_w550_h550.jpg";"http://medinweb.ru/images/detailed/0/mbank15770_w550_h550.jpg";"min:0;max:0";"length:0;width:0;height:0";"Simtech";"";"";"N";"N";"Y";"Y";"";"";"";"0";"0";""
"E0183D500N";"ru";"183";"Electronics///Cameras & Photo///Lenses";"0.00";"249.99";"0.00";"5";"0";"0.00";"08 Feb 2012 00:00:00";"N";"";"N";"B";"N";"N";"R";"";"/var/www/medinweb.ru/public/var/files/1/exim/backup/images/NX_50-200_Lens_600.jpg#{[ru]:;}";"Samsung 50-200mm NX Telephoto OIS Lens";"<p>The Samsung T50200SB 50-200mm Telephoto OIS Lens is a long telephoto zoom lens compatible with our NX Series of digital cameras.</p>";"";"";"";"";"VAT";"Производитель: E[Nikon]";"";"";"samsung-50-200mm-nx-telephoto-ois-lens";"";"";"A";"0";"0";"0";"N";"http://medinweb.ru/electronics/cameras-and-photo/lenses/samsung-50-200mm-nx-telephoto-ois-lens.html";"http://medinweb.ru/images/detailed/0/NX_50-200_Lens_600.jpg";"http://medinweb.ru/images/detailed/0/NX_50-200_Lens_600.jpg";"min:0;max:0";"length:0;width:0;height:0";"Simtech";"";"";"N";"N";"Y";"Y";"";"";"";"0";"0";""
"D0184CU1VL";"ru";"184";"Electronics///Cameras & Photo///Lenses";"0.00";"299.99";"0.00";"5";"0";"0.00";"08 Feb 2012 00:00:00";"N";"";"N";"B";"N";"N";"R";"";"/var/www/medinweb.ru/public/var/files/1/exim/backup/images/ED-30NB_pancake2_600_1.jpg#{[ru]:;}";"Samsung 30mm NX Pancake Lens";"<p>Samsung&rsquo;s compact 30mm pancake lens is the brightest in its class. With its 30mm fixed focal length and maximum aperture of F/2, you can capture exceptionally bright images &mdash; even in low-light situations such as shady forest paths and indoor weddings. You can also create striking, images with shallow depth of field in a variety of settings. And since it&rsquo;s incredibly slim and lightweight, you can take it with you everywhere.</p>";"";"";"";"";"VAT";"Производитель: E[Nikon]";"";"";"samsung-30mm-nx-pancake-lens";"";"";"A";"0";"0";"0";"N";"http://medinweb.ru/electronics/cameras-and-photo/lenses/samsung-30mm-nx-pancake-lens.html";"http://medinweb.ru/images/detailed/0/ED-30NB_pancake2_600_1.jpg";"http://medinweb.ru/images/detailed/0/ED-30NB_pancake2_600_1.jpg";"min:0;max:0";"length:0;width:0;height:0";"Simtech";"";"";"N";"N";"Y";"Y";"";"";"";"0";"0";""
"B0185I7U24";"ru";"185";"Sports & Outdoors///Golf///Golf Bags & Carts";"0.00";"139.99";"0.00";"5";"0";"0.00";"08 Feb 2012 00:00:00";"N";"";"N";"B";"N";"N";"R";"";"/var/www/medinweb.ru/public/var/files/1/exim/backup/images/5e1cdabf5a35c38ba2b747c9adfddb7f.jpg#{[ru]:;}";"CG Lightweight Cart Bag";"<p>CG Lightweight Cart bags are perfect for push and power carts</p>";"";"";"";"";"VAT";"Производитель: E[Cleveland]";"";"";"cg-lightweight-cart-bag";"";"";"A";"0";"0";"0";"N";"http://medinweb.ru/sports-and-outdoors/golf/golf-bags-and-carts/cg-lightweight-cart-bag.html";"http://medinweb.ru/images/detailed/0/5e1cdabf5a35c38ba2b747c9adfddb7f.jpg";"http://medinweb.ru/images/detailed/0/5e1cdabf5a35c38ba2b747c9adfddb7f.jpg";"min:0;max:0";"length:0;width:0;height:0";"Simtech";"";"";"N";"N";"Y";"Y";"";"";"";"0";"0";""
"N01868E9SB";"ru";"186";"Sports & Outdoors///Golf///Golf Bags & Carts";"0.00";"299.99";"0.00";"49";"0";"0.00";"08 Feb 2012 00:00:00";"N";"";"N";"B";"N";"N";"R";"";"/var/www/medinweb.ru/public/var/files/1/exim/backup/images/8ad650de56e5e2272b240d3a6c171545.jpg#{[ru]:;}";"CG Black Staff Bag";"<h3 class=""product_availability"">Item is not available at this time.<br />Can be Preordered.</h3>";"";"";"";"";"VAT";"Производитель: E[Cleveland]";"";"";"cg-black-staff-bag";"";"";"A";"0";"0";"0";"N";"http://medinweb.ru/sports-and-outdoors/golf/golf-bags-and-carts/cg-black-staff-bag.html";"http://medinweb.ru/images/detailed/0/8ad650de56e5e2272b240d3a6c171545.jpg";"http://medinweb.ru/images/detailed/0/8ad650de56e5e2272b240d3a6c171545.jpg";"min:0;max:0";"length:0;width:0;height:0";"Simtech";"";"";"N";"N";"Y";"Y";"";"";"";"0";"0";""
"D0187LXFZO";"ru";"187";"Sports & Outdoors///Golf///Golf Bags & Carts";"0.00";"299.99";"0.00";"10";"0";"0.00";"08 Feb 2012 00:00:00";"N";"";"N";"B";"N";"N";"R";"";"/var/www/medinweb.ru/public/var/files/1/exim/backup/images/167734bda696f56942c278bee07e7236.jpg#{[ru]:;}";"2010 TOUR STAFF Bag 10""";"<p>Used by Cleveland Golf tour staff players worldwide</p>";"";"";"";"";"VAT";"Производитель: E[Cleveland]";"";"";"2010-tour-staff-bag-10";"";"";"A";"0";"0";"0";"N";"http://medinweb.ru/sports-and-outdoors/golf/golf-bags-and-carts/2010-tour-staff-bag-10.html";"http://medinweb.ru/images/detailed/0/167734bda696f56942c278bee07e7236.jpg";"http://medinweb.ru/images/detailed/0/167734bda696f56942c278bee07e7236.jpg";"min:0;max:0";"length:0;width:0;height:0";"Simtech";"";"";"N";"N";"Y";"Y";"";"";"";"0";"0";""
"M0188MVCYL";"ru";"188";"Sports & Outdoors///Golf///Golf Balls";"0.00";"10.00";"0.00";"99";"0";"0.00";"08 Feb 2012 00:00:00";"N";"";"N";"B";"N";"N";"R";"";"/var/www/medinweb.ru/public/var/files/1/exim/backup/images/50Elite_Yellow_12ball_Render.jpg#{[ru]:;}";"NEW Wilson Staff Fifty Elite Yellow Golf Ball";"<p>An aggressive core is offset by a responsive cover; Explosive distance is coupled with soft feel; Low driver spin is offset by high greenside spin; Long carry, quick stop</p>";"";"";"";"";"VAT";"Производитель: E[Wilson Staff]";"";"";"new-wilson-staff-fifty-elite-yellow-golf-ball";"";"";"A";"0";"0";"0";"N";"http://medinweb.ru/sports-and-outdoors/golf/golf-balls/new-wilson-staff-fifty-elite-yellow-golf-ball.html";"http://medinweb.ru/images/detailed/0/50Elite_Yellow_12ball_Render.jpg";"http://medinweb.ru/images/detailed/0/50Elite_Yellow_12ball_Render.jpg";"min:0;max:0";"length:0;width:0;height:0";"Simtech";"";"";"N";"N";"Y";"Y";"";"";"";"0";"0";""
"O0189UKMNW";"ru";"189";"Electronics///Cameras & Photo///Lenses";"0.00";"1.00";"0.00";"5";"0";"0.00";"08 Feb 2012 00:00:00";"N";"";"N";"B";"N";"N";"R";"";"/var/www/medinweb.ru/public/var/files/1/exim/backup/images/2163_1.jpg#{[ru]:;}";"AF-S NIKKOR 14-24mm f/2.8G ED";"<p>Fast aperture, high-performance, ultra-wide-angle zoom optimized for FX- and DX-format sensors featuring Nikon&rsquo;s exclusive ED Glass and Nano Crystal Coat.</p>";"";"";"";"";"VAT";"Производитель: E[Nikon]";"";"";"af-s-nikkor-14-24mm-f-2.8g-ed";"";"";"A";"0";"0";"0";"N";"http://medinweb.ru/electronics/cameras-and-photo/lenses/af-s-nikkor-14-24mm-f-2.8g-ed.html";"http://medinweb.ru/images/detailed/0/2163_1.jpg";"http://medinweb.ru/images/detailed/0/2163_1.jpg";"min:0;max:0";"length:0;width:0;height:0";"Simtech";"";"";"N";"N";"Y";"Y";"";"";"";"0";"0";""
"O019015C2L";"ru";"190";"Electronics///Cameras & Photo///Lenses";"0.00";"899.95";"0.00";"5";"0";"0.00";"08 Feb 2012 00:00:00";"N";"";"N";"B";"N";"N";"R";"";"/var/www/medinweb.ru/public/var/files/1/exim/backup/images/2181_1.jpg#{[ru]:;}";"AF-S DX NIKKOR 10-24mm f/3.5-4.5G ED";"<p>This ultra wide-angle lens, designed exclusively for use with Nikon&rsquo;s DX-format, provides a versatile wide-angle zoom perspective.</p>";"";"";"";"";"VAT";"Производитель: E[Nikon]";"";"";"af-s-dx-nikkor-10-24mm-f-3.5-4.5g-ed";"";"";"A";"0";"0";"0";"N";"http://medinweb.ru/electronics/cameras-and-photo/lenses/af-s-dx-nikkor-10-24mm-f-3.5-4.5g-ed.html";"http://medinweb.ru/images/detailed/0/2181_1.jpg";"http://medinweb.ru/images/detailed/0/2181_1.jpg";"min:0;max:0";"length:0;width:0;height:0";"Simtech";"";"";"N";"N";"Y";"Y";"";"";"";"0";"0";""
