"C0106D3GWB";"ru";"106";"Electronics///Cell Phones///Nokia";"0.00";"179.99";"0.00";"12";"0";"0.00";"08 Feb 2012 00:00:00";"N";"";"N";"B";"N";"N";"R";"";"/var/www/medinweb.ru/public/var/files/1/exim/backup/images/E5-black-front-black-png13286888164f322eb054f4c.jpg#{[ru]:;}";"Nokia E5-00";"<p>Discover more ways to stay connected with friends, family, business contacts and everyone important to you with the Nokia E5-00. It has everything you need to stay in touch with a variety of email and messaging options, while also helping you to take and share pics and videos, explore the web, connect through social networking, access work and personal email, navigate your day and more. The affordable Nokia E5 even manages to fit a full QWERTY keyboard into its compact, eye-catching design for quick and easy messaging on the go. Plus, there are plenty of features to make it the perfect business-focused device. Stay productive and stay in the loop with work no matter where you are with simple setup and access for your corporate email account. The Nokia E5 makes communicating with work a breeze with Mail for Exchange, the free, direct and secure corporate email solution that offers a robust desktop-like email experience right on your phone, with email, calendar, contacts and more. Plus, your work email shows up on your phone instantly, so you don&rsquo;t have to wait for important emails. The Nokia E5 also features a fully integrated Microsoft Communicator Mobile client, to provide your mobile device the same great IM, contacts and usability that you enjoy on your computer. Keep in touch however you like with a variety of ways to connect to others with the Nokia E5. The home screen offers an easy visual way to view your contacts and makes it easy to organize the people you talk to most. The Nokia E5 also features one-click access to messaging as well as easy email setup and support for plenty of popular personal email services. The leading IM services have also been seamlessly integrated onto the phone. The Nokia E5 also offers free voice-guided navigation from Ovi Maps so you always know where you&rsquo;re going. Plus customize your phone with thousands of available apps from Ovi Store. Connect with everyone and everything you want with the Nokia E5.</p>";"";"";"";"";"VAT";"Производитель: E[Nokia]";"";"";"nokia-e5-00";"";"";"A";"0";"0";"0";"N";"http://medinweb.ru/electronics/cell-phones/nokia/nokia-e5-00.html";"http://medinweb.ru/images/detailed/0/E5-black-front-black-png13286888164f322eb054f4c.jpg";"http://medinweb.ru/images/detailed/0/E5-black-front-black-png13286888164f322eb054f4c.jpg";"min:0;max:0";"length:0;width:0;height:0";"Simtech";"";"";"N";"N";"Y";"Y";"";"";"";"0";"0";""
"F01072HXUI";"ru";"107";"Apparel///Watches & Jewelry";"0.00";"465.00";"0.00";"20";"0";"0.00";"08 Feb 2012 00:00:00";"N";"";"N";"B";"N";"N";"R";"";"/var/www/medinweb.ru/public/var/files/1/exim/backup/images/03804_l.ashx.jpg#{[ru]:;}";"Montblanc Classic Collection Money Clip";"<p>Platinum-plated money clip with black onyx inlay</p>";"";"";"";"";"VAT";"Производитель: E[Montblanc]";"";"";"montblanc-classic-collection-money-clip";"";"";"A";"0";"0";"0";"N";"http://medinweb.ru/apparel/watches-and-jewelry/montblanc-classic-collection-money-clip.html";"http://medinweb.ru/images/detailed/0/03804_l.ashx.jpg";"http://medinweb.ru/images/detailed/0/03804_l.ashx.jpg";"min:0;max:0";"length:0;width:0;height:0";"Simtech";"";"";"N";"N";"Y";"Y";"";"";"";"0";"0";""
"I0108TD8BL";"ru";"108";"Movies & TV///Blu-ray Discs";"0.00";"12.99";"0.00";"30";"0";"0.00";"08 Feb 2012 00:00:00";"N";"";"N";"B";"N";"N";"R";"";"/var/www/medinweb.ru/public/var/files/1/exim/backup/images/2891878.jpg#{[ru]:;}";"Due Date (Blu-ray)";"<p><p>Studio: Warner Bros.</p><p>Theatrical Release Date: 11/04/2010</p><p>Special Features:</p><p>- Deleted Scenes</p><p>- Action Mashup</p><p>- Too Many Questions Mashup</p><p>- Gag Reel</p><p>- ""Two and a Half Men"" Sequence featuring Ethan Tremblay</p><p>MUST REDEEM DIGITAL COPY OFFER BY 2/20/12</p><p>Packaging Type: Blue BD Case</p><p>Copyright:</p><p>&copy; 2010 Warner Bros. Entertainment. All Rights Reserved.</p><p>Genre: Comedy</p><p>Synopsis:</p><p>From The Hangover director Todd Phillips, Due Date throws two unlikely companions together on a road trip that turns out to be as life-changing as it is outrageous. Expectant first-time father Peter Highman (Robert Downey Jr.) looks forward to his new child&rsquo;s due date five days away. As Peter hurries to catch a flight home from Atlanta to be at his wife&rsquo;s side for the birth, his best intentions go completely awry when an encounter with aspiring actor Ethan Tremblay (Zach Galifianakis) forces Peter to hitch a ride with Ethan on a cross-country trip that will ultimately destroy several cars, many friendships and Peter&rsquo;s last nerve.</p></p>";"";"";"";"";"VAT";"Производитель: E[Warner Home Video ]";"";"";"due-date-blu-ray";"";"";"A";"0";"0";"0";"N";"http://medinweb.ru/movies-and-tv/blu-ray-discs/due-date-blu-ray.html";"http://medinweb.ru/images/detailed/0/2891878.jpg";"http://medinweb.ru/images/detailed/0/2891878.jpg";"min:0;max:0";"length:0;width:0;height:0";"Simtech";"";"";"N";"N";"Y";"Y";"";"";"";"0";"0";""
"C01099FRFC";"ru";"109";"Apparel///Watches & Jewelry";"0.00";"140.00";"0.00";"10";"0";"0.00";"08 Feb 2012 00:00:00";"N";"";"N";"B";"N";"N";"R";"";"/var/www/medinweb.ru/public/var/files/1/exim/backup/images/101796_l.ashx.jpg#{[ru]:;}";"Montblanc Contemporary Collection Key Ring with Montblanc emblem";"<p>Stainless steel key ring with brown calf leather</p>";"";"";"";"";"VAT";"Производитель: E[Montblanc]";"";"";"montblanc-contemporary-collection-key-ring-with-montblanc-emblem";"";"";"A";"0";"0";"0";"N";"http://medinweb.ru/apparel/watches-and-jewelry/montblanc-contemporary-collection-key-ring-with-montblanc-emblem.html";"http://medinweb.ru/images/detailed/0/101796_l.ashx.jpg";"http://medinweb.ru/images/detailed/0/101796_l.ashx.jpg";"min:0;max:0";"length:0;width:0;height:0";"Simtech";"";"";"N";"N";"Y";"Y";"";"";"";"0";"0";""
"E01105O46P";"ru";"110";"Movies & TV///Movies (DVD)";"0.00";"15.99";"0.00";"13";"0";"0.00";"08 Feb 2012 00:00:00";"N";"";"N";"B";"N";"N";"R";"";"/var/www/medinweb.ru/public/var/files/1/exim/backup/images/1565865.jpg#{[ru]:;}";"Roots 30th Anniversary Special Edition (DVD)";"<p><p>Studio: Warner Bros.</p><p>Screen Aspect: 4 X 3 FULL FRAME</p><p>Media Quantity: Multi D</p><p>Packaging Type: Slipcase - Super Slim</p><p>Copyright:</p><p>TM &amp; (c) Warner Bros. Entertainment Inc.</p><p>Genre: Black Theme or Star</p><p>Synopsis:</p><p>Based on Alex Haley's best-selling novel about his African ancestors, Roots followed several generations in the lives of a slave family. The saga began with Kunta Kinte (LeVar Burton), a West African youth captured by slave raiders and shipped to America in the 1700s. The family's saga is depicted up until the Civil War where Kunte Kinte's grandson gained emancipation. Roots made its greatest impression on the ratings and widespread popularity it garnered. On average, 130 million - almost half the country at the time - saw all or part of the series.</p></p>";"";"";"";"";"VAT";"Производитель: E[Warner Home Video ]";"";"";"roots-30th-anniversary-special-edition-dvd";"";"";"A";"0";"0";"0";"N";"http://medinweb.ru/movies-and-tv/movies-dvd/roots-30th-anniversary-special-edition-dvd.html";"http://medinweb.ru/images/detailed/0/1565865.jpg";"http://medinweb.ru/images/detailed/0/1565865.jpg";"min:0;max:0";"length:0;width:0;height:0";"Simtech";"";"";"N";"N";"Y";"Y";"";"";"";"0";"0";""
"F0111O12WW";"ru";"111";"Movies & TV///Movies (DVD)";"0.00";"6.99";"0.00";"15";"0";"0.00";"08 Feb 2012 00:00:00";"N";"";"N";"B";"N";"N";"R";"";"/var/www/medinweb.ru/public/var/files/1/exim/backup/images/2411125.jpg#{[ru]:;}";"Last Samurai, The (DVD) (WS)";"<p><p>Official Website: http://lastsamurai.warnerbros.com/</p><p>Studio: Warner Bros.</p><p>Theatrical Release Date: 12/04/2003</p><p>Screen Aspect: 16 X 9 LETTERBOX</p><p>Run Time: 154 minutes</p><p>Special Features:</p><p>Audio Commentary: Commentary by Edward Zwick</p><p>Deleted Scenes: The Beheading (Behind the Beheading)</p><p>&nbsp;</p><p>Algren and Katsumoto</p><p>&nbsp;</p><p>Documentaries: History vs. Hollywood: The Last Samurai {History Channel Documentary)</p><p>Featurette: Tom Cruise: A Warrior's Journey</p><p>&nbsp;</p><p>Edward Zwick: Director's Video Journal {Behind-the-scenes production journal - narrated by Ed Zwick and Tom Cruise</p><p>&nbsp;</p><p>A World of Detail: Production Design with Lilly Kilvert</p><p>&nbsp;</p><p>Silk and Armor: Costume Design with Ngila Dickson</p><p>&nbsp;</p><p>Imperial Army Basic Training: From Soldier to Samurai: The Weapons</p><p>&nbsp;</p><p>&nbsp;</p><p>Interviews: Making an Epic: A Conversation with Edward Zwick</p><p>Other: Japan Premieres {Tokyo &amp; Kyoto red carpet)</p><p>Packaging Type: Eco Amaray Case</p><p>Subtitle Languages:</p><p>English</p><p>French</p><p>Spanish</p><p>Copyright:</p><p>&copy; 2003 Warner Bros. Entertainment Inc. All Rights Reserved.</p><p>Genre: Action/Adventure, Drama, Period, War, WESTERN</p><p>Synopsis:</p><p>Epic Action Drama. Set in Japan during the 1870s, The Last Samurai tells the story of Capt. Nathan Algren (Tom Cruise), a respected American military officer hired by the Emperor of Japan to train the country's first army in the art of modern warfare. As the Emperor attempts to eradicate the ancient Imperial Samurai warriors in preparation for more Westernized and trade-friendly government policies, Algren finds himself unexpectedly impressed and influenced by his encounters with the Samurai, which places him at the center of a struggle between two eras and two worlds, with only his own sense of honor to guide him.</p><p>""Two Thumbs Up"" - EBERT &amp; ROEPER&nbsp;</p><p>&nbsp;</p><p>""A stunning beautiful epic adventure"" - ROGER EBERT / EBERT &amp; ROEPER&nbsp;</p><p>&nbsp;</p><p>""It's a spectacular epic. Tom Cruise is truly magnificent. - PAUL CLINTON / CNN&nbsp;</p><p>&nbsp;</p><p>""Ken Watanabe is magnetic and majestic."" - LISA SCHWARZBAUM / ENTERTAINMENT WEEKLY&nbsp;</p><p>&nbsp;</p><p>""The Last Samurai is a movie that demands our surrender"" - RICHARD SCHICKEL / TIME&nbsp;</p><p>&nbsp;</p><p>""Bold and daring. The battle scenes are astonishing!"" - JEFFREY LYONS / NBC&nbsp;</p><p>&nbsp;</p><p>""The Last Samurai' is a transfixing, majestic experience."" - GENE SHAL</p></p>";"";"";"";"";"VAT";"";"";"";"last-samurai-the-dvd-ws";"";"";"A";"0";"0";"0";"N";"http://medinweb.ru/movies-and-tv/movies-dvd/last-samurai-the-dvd-ws.html";"http://medinweb.ru/images/detailed/0/2411125.jpg";"http://medinweb.ru/images/detailed/0/2411125.jpg";"min:0;max:0";"length:0;width:0;height:0";"Simtech";"";"";"N";"N";"Y";"Y";"";"";"";"0";"0";""
"U0114N9X4E";"ru";"114";"Movies & TV///Movies (DVD)";"0.00";"14.99";"0.00";"9";"0";"0.00";"08 Feb 2012 00:00:00";"N";"";"N";"B";"N";"N";"R";"";"/var/www/medinweb.ru/public/var/files/1/exim/backup/images/1917865.jpg#{[ru]:;}";"Birds of Prey: The Complete Series (DVD)";"<p><p>Studio: Warner Bros.</p><p>Screen Aspect: 4 X 3 FULL FRAME</p><p>Episodes Info :</p><p>13 One-Hour Episodes</p><p>&nbsp;</p><p>Pilot</p><p>Slick</p><p>Prey for the Hunter</p><p>Three Birds and a Baby</p><p>Sins of the Mother</p><p>Primal Scream</p><p>Split</p><p>Lady Shiva</p><p>Nature of the Beast</p><p>Gladiatrix</p><p>Reunion</p><p>Feat of Clay</p><p>Devil's Eye</p><p>Special Features:</p><p>GOTHAM GIRLS SEASONS 1-3 - The animated web-based series featuring the</p><p>female heroes and rogues from Gotham City.</p><p>Media Quantity: Multi D</p><p>Packaging Type: VIVA 4 Disc 15mm Case</p><p>Genre: Drama, Television</p><p>Synopsis:</p><p>Who will stand up to villains now that a heartbroken Dark Knight has mysteriously vanished? Never fear, New Gothamites, a trio of champions is ready to take wing &ndash; and Helena, the daughter of Batman and Catwoman, is among them. She calls herself Huntress and crime is her prey. Teenaged Dinah is the youngest of the group, learning as she goes and gifted in clairvoyance. And overseeing the awesome threesome&rsquo;s high-tech nerve center is Batgirl. Left wheelchair-bound by The Joker, she has reinvented herself as Oracle, the team&rsquo;s cyber expert. Huntress, Dinah, Oracle: They are the Birds of Prey. Fighting together. Living together. And soaring into adventure together in 13 breathtaking live-action episodes.</p></p>";"";"";"";"";"VAT";"Производитель: E[Warner Home Video ]";"";"";"birds-of-prey-the-complete-series-dvd";"";"";"A";"0";"0";"0";"N";"http://medinweb.ru/movies-and-tv/movies-dvd/birds-of-prey-the-complete-series-dvd.html";"http://medinweb.ru/images/detailed/0/1917865.jpg";"http://medinweb.ru/images/detailed/0/1917865.jpg";"min:0;max:0";"length:0;width:0;height:0";"Simtech";"";"";"N";"N";"Y";"Y";"";"";"";"0";"0";""
"N0115R3FDX";"ru";"115";"Sports & Outdoors///Bikes///Mountain Bikes";"0.00";"4595.00";"0.00";"15";"0";"0.00";"08 Feb 2012 00:00:00";"N";"";"N";"B";"N";"N";"R";"";"/var/www/medinweb.ru/public/var/files/1/exim/backup/images/CB-evolve.jpg#{[ru]:;}";"Evolve SST.2 X9 Complete Bike 10SPD '12";"<p><span class=""content"">The all new 100mm travel Evolve sst.2 with ICT  Technology is dialed in to maintain the legendary efficiency, handling  and ride of a nimble full suspension cross country bike while harnessing  the rolling efficiency and feel of the 29"" wheel.  The NEW super formed  pivot integrated seat tube is lighter and stronger while the NEW  semi-integrated tapered head tube is stiffer and more responsive. </span></p>";"";"";"";"";"VAT";"";"";"";"evolve-sst.2-x9-complete-bike-10spd-12";"";"";"A";"0";"0";"0";"N";"http://medinweb.ru/sports-and-outdoors/bikes/mountain-bikes/evolve-sst.2-x9-complete-bike-10spd-12.html";"http://medinweb.ru/images/detailed/0/CB-evolve.jpg";"http://medinweb.ru/images/detailed/0/CB-evolve.jpg";"min:0;max:0";"length:0;width:0;height:0";"Simtech";"";"";"N";"N";"Y";"Y";"";"";"";"0";"0";""
"P01160R6WH";"ru";"116";"Movies & TV///Movies (DVD)";"0.00";"6.99";"0.00";"20";"0";"0.00";"08 Feb 2012 00:00:00";"N";"";"N";"B";"N";"N";"R";"";"/var/www/medinweb.ru/public/var/files/1/exim/backup/images/1837696.jpg#{[ru]:;}";"I Am Legend (DVD) (WS)";"<p><p>fficial Website: <a title=""http://iamlegend.warnerbros.com/"" href=""http://iamlegend.warnerbros.com/"">http://iamlegend.warnerbros.com/</a></p><p>Studio: Warner Bros.</p><p>Theatrical Release Date: 12/13/2007</p><p>Screen Aspect: 16 X 9 LETTERBOX</p><p>Special Features:</p><p>4 awesome animated comics: Death as a gift, Isolation, Sacrificing the Few for the Many and Shelter</p><p>DVD-ROM PC weblink to intense bonus material databanki chronicling the movie's creation and exploring the history and current status</p><p>of life-threatening viral infections</p><p>Packaging Type: Amaray Case</p><p>Copyright:</p><p>(c) 2007 A Warner Bros. Entertainment Inc. All Rights Reserved</p><p>Genre: Action/Adventure, Drama, Horror, Sci-Fi/Fantasy</p><p>Synopsis:</p><p>Robert Neville is a brilliant scientist, but even he could not contain the terrible virus that was unstoppable, incurable, and man-made. Somehow immune, Neville is now the last human survivor in what is left of New York City and maybe the world. For three years, Neville has faithfully sent out daily radio messages, desperate to find any other survivors who might be out there. But he is not alone. Mutant victims of the plague -- The Infected -- lurk in the shadows... watching Neville's every move... waiting for him to make a fatal mistake. Perhaps mankind's last, best hope, Neville is driven by only one remaining mission: to find a way to reverse the effects of the virus using his own immune blood. But he knows he is outnumbered... and quickly running out of time.</p><p>""I Am Legend is mind-blowing excitement..."" Pete Hammond / Maxim</p></p>";"";"";"";"";"VAT";"Производитель: E[Warner Home Video ]";"";"";"i-am-legend-dvd-ws";"";"";"A";"0";"0";"0";"N";"http://medinweb.ru/movies-and-tv/movies-dvd/i-am-legend-dvd-ws.html";"http://medinweb.ru/images/detailed/0/1837696.jpg";"http://medinweb.ru/images/detailed/0/1837696.jpg";"min:0;max:0";"length:0;width:0;height:0";"Simtech";"";"";"N";"N";"Y";"Y";"";"";"";"0";"0";""
"C0117E8CC7";"ru";"117";"Electronics///Cell Phones///Samsung";"0.00";"729.99";"0.00";"10";"0";"0.00";"08 Feb 2012 00:00:00";"N";"";"N";"B";"N";"N";"R";"";"/var/www/medinweb.ru/public/var/files/1/exim/backup/images/i515_400x400_large1_cf_1.jpg#{[ru]:;}";"SCH-I515";"<p>Galaxy Nexus is the world's first phone with a 4.65"" high-definition  Super AMOLED display, making text, photos, videos and games look crisp,  vibrant and rich. With 1280x720 HD resolution, videos look amazing and  the unique Contour Display curves nicely to the shape of your face and  makes it easier to hold.</p>";"";"";"";"";"VAT";"Производитель: E[Samsung]";"";"";"sch-i515";"";"";"A";"0";"0";"0";"N";"http://medinweb.ru/electronics/cell-phones/samsung/sch-i515.html";"http://medinweb.ru/images/detailed/0/i515_400x400_large1_cf_1.jpg";"http://medinweb.ru/images/detailed/0/i515_400x400_large1_cf_1.jpg";"min:0;max:0";"length:0;width:0;height:0";"Simtech";"";"";"N";"N";"Y";"Y";"";"";"";"0";"0";""
"H0118GRDLH";"ru";"118";"Movies & TV///TV Shows (DVD)";"0.00";"30.99";"0.00";"35";"0";"0.00";"08 Feb 2012 00:00:00";"N";"";"N";"B";"N";"N";"R";"";"/var/www/medinweb.ru/public/var/files/1/exim/backup/images/1000173538_f.jpg#{[ru]:;}";"Smallville: The Complete Tenth Season";"<p><p>Studio: Warner Bros.</p><p>Screen Aspect: 16 X 9 FULL FRAME</p><p>Run Time: 1012 minutes</p><p>Episodes Info :</p><p>Lazarus</p><p>Shield</p><p>Supergirl</p><p>Homecoming</p><p>Isis</p><p>Harvest</p><p>Ambush</p><p>Abandoned</p><p>Patriot</p><p>Luthor</p><p>Icarus</p><p>Collateral</p><p>Beacon</p><p>Masquerade</p><p>Fortune</p><p>Scion</p><p>Kent</p><p>Booster</p><p>Dominion</p><p>Prophecy</p><p>Finale Part 1</p><p>Finale Part 2</p><p>Special Features:</p><p>Commentaries on 2 Key Episodes</p><p>Unaired Scenes</p><p>Smallville: Coming Home: Cast and Creators Reflect on the Landmark 200th Episode Homecoming, in Which Clark Kent Experiences</p><p>Transformative Events on the Way to His Final Destiny</p><p>My Fathers, My Son: How Clark Kent&rsquo;s Fathers/Son Relationships Evolved over the Series&rsquo; 10 Years</p><p>How Do We Do Music Video</p><p>Media Quantity: Multi D</p><p>Packaging Type: VIVA 6 Disc 25mm Case</p><p>Subtitle Languages:</p><p>Chinese</p><p>French</p><p>Portuguese</p><p>Spanish</p><p>Copyright:</p><p>SMALLVILLE and all related characters and elements are trademarks of and &copy; DC Comics.</p><p>Genre: Drama, Television</p><p>Synopsis:</p><p>The series that redefines the origins of the world&rsquo;s greatest hero reaches its powerful conclusion with more revelations, more fascinating characters from DC Comics lore and a mind-blowing, spirit-lifting finale that is everything fans could want. In this 22-Episode Season 10, super heroes emerge from the shadows, only to be driven underground by a public that labels them vigilantes. At the same time, otherworld forces of darkness gather, presenting Clark Kent with the greatest challenge of his young life. The world he calls home and the people he loves &ndash; including Lois Lane, who now shares his secret and his life &ndash; need a champion. They shall have one. Don&rsquo;t miss all the hopes, heartaches and heroics of a final season to remember. They will lift you up, up and away.</p></p>";"";"";"";"";"VAT";"Производитель: E[Warner Home Video ]";"";"";"smallville-the-complete-tenth-season";"";"";"A";"0";"0";"0";"N";"http://medinweb.ru/movies-and-tv/tv-shows-dvd/smallville-the-complete-tenth-season.html";"http://medinweb.ru/images/detailed/0/1000173538_f.jpg";"http://medinweb.ru/images/detailed/0/1000173538_f.jpg";"min:0;max:0";"length:0;width:0;height:0";"Simtech";"";"";"N";"N";"Y";"Y";"";"";"";"0";"0";""
"R0119703TC";"ru";"119";"Movies & TV///TV Shows (DVD)";"0.00";"17.99";"0.00";"15";"0";"0.00";"08 Feb 2012 00:00:00";"N";"";"N";"B";"N";"N";"R";"";"/var/www/medinweb.ru/public/var/files/1/exim/backup/images/2957882.jpg#{[ru]:;}";"The Big Bang Theory: The Complete Fourth Season";"<p><p>Studio: Warner Bros.</p><p>Screen Aspect: 16 X 9 LETTERBOX</p><p>Run Time: 529 minutes</p><p>Episodes Info :</p><p>The Robotic Manipulation</p><p>The Cruciferous Vegetable Amplification</p><p>The Zazzy Substitution</p><p>The Hot Troll Deviation</p><p>The Desperation Emanation</p><p>The Irish Pub Formulation</p><p>The Apology Insufficiency</p><p>The 21-Second Excitation</p><p>The Boyfriend Complexity</p><p>The Alien Parasite Hypothesis</p><p>The Justice League Recombination</p><p>The Bus Pants Utilization</p><p>The Love Car Displacement</p><p>The Thespian Catalyst</p><p>The Benefactor Factor</p><p>The Cohabitation Formulation</p><p>The Toast Derivation</p><p>The Prestidigitation Approximation</p><p>The Zarnecki Incursion</p><p>The Herb Garden Germination</p><p>The Agreement Dissection</p><p>The Wildebeest Implementation</p><p>The Engagement Reaction</p><p>The Roommate Transmogrification</p><p>Special Features:</p><p>Actor on Actor: The Big Bang's Theory of Relativity Featurette -This fun and light-hearted piece features the stars of the show</p><p>conducting interviews with each other detailing their experiences working on one of the hottest comedies on television.</p><p>The Barenaked Ladies on Big Bang Theory Featurette - Having created one of the greatest theme songs in recent history, the Barenaked</p><p>Ladies bring it home when they come to the set of the Big Bang Theory to record a music video for the song. Featuring an interview</p><p>with the band, behind the scenes footage of the filming of an episode, and clips from the new video itself, this piece carries with</p><p>it all of the fun and energy you could expect from both the band and the show.</p><p>The History of Everything Music Video</p><p>Gag Reel</p><p>Media Quantity: Multi D</p><p>Packaging Type: VIVA 4 Disc 15mm Case</p><p>Subtitle Languages:</p><p>Chinese</p><p>English SDH</p><p>French</p><p>Portuguese</p><p>Spanish</p><p>Thai</p><p>Copyright:</p><p>BIG BANG THEORY and all related characters and elements are trademarks of and &copy; Warner Bros. Entertainment Inc.</p><p>Genre: Comedy, Television</p><p>Synopsis:</p><p>&ldquo;Four seasons in, it is still laugh-out-loud funny. Every episode, every week,&rdquo; USA Today&rsquo;s Robert Bianco says about the hit series The Big Bang Theory. Here&rsquo;s your chance to subject his conclusion to empirical analysis by watching all 24 Season 4 Episodes! This season the Big Bang gang&rsquo;s romantic universe expands. On the rebound from Penny, Leonard falls into the arms of Raj&rsquo;s sister Priya. Sheldon gets a girlfriend, or rather a friend who is a girl: Amy, a dour neurobiologist who declares herself besties with Penny. Howard and Bernadette heat up. And so do Raj and Bernadette (at least in Raj&rsquo;s Bollywood daydream). All in the furtherance of award-winning genius comedy.</p></p>";"";"";"";"";"VAT";"Производитель: E[Warner Home Video ]";"";"";"the-big-bang-theory-the-complete-fourth-season";"";"";"A";"0";"0";"0";"N";"http://medinweb.ru/movies-and-tv/tv-shows-dvd/the-big-bang-theory-the-complete-fourth-season.html";"http://medinweb.ru/images/detailed/0/2957882.jpg";"http://medinweb.ru/images/detailed/0/2957882.jpg";"min:0;max:0";"length:0;width:0;height:0";"Simtech";"";"";"N";"N";"Y";"Y";"";"";"";"0";"0";""
"B0120TBX2K";"ru";"120";"Electronics///Cell Phones///Samsung";"0.00";"199.99";"0.00";"9";"0";"0.00";"08 Feb 2012 00:00:00";"N";"";"N";"B";"N";"N";"R";"";"/var/www/medinweb.ru/public/var/files/1/exim/backup/images/d710_600x600_xlarge_cf.jpg#{[ru]:;}";"Samsung Galaxy S II, Epic 4G Touch (Black)";"<p>The fastest, state-of-the-art networks are 4G, so naturally, the Epic&trade;  4G Touch is designed for speed. With 4G, every download, upload, app,  game, connection and feature runs almost as fast as you can push the  button.</p>";"";"";"";"";"VAT";"Производитель: E[Samsung]";"";"";"samsung-galaxy-s-ii-epic-4g-touch-black";"";"";"A";"0";"0";"0";"N";"http://medinweb.ru/electronics/cell-phones/samsung/samsung-galaxy-s-ii-epic-4g-touch-black.html";"http://medinweb.ru/images/detailed/0/d710_600x600_xlarge_cf.jpg";"http://medinweb.ru/images/detailed/0/d710_600x600_xlarge_cf.jpg";"min:0;max:0";"length:0;width:0;height:0";"Simtech";"";"";"N";"N";"Y";"Y";"";"";"";"0";"0";""
